{
  "version": 1,
  "app": {
    "name": "Example App",
    "slug": "example-app",
    "bin": "example-app",
    "platform": "web",
    "defaultMode": "auto",
    "homeDir": ".example-app",
    "defaultSessionName": "example-app",
    "baseUrl": "https://example.com"
  },
  "auth": {
    "strategy": "state-file",
    "loginUrl": "https://example.com/login",
    "stateFile": "auth-state.json",
    "loginFlowId": "auth-login",
    "env": [
      {
        "name": "APP_USERNAME",
        "description": "Login username or email"
      },
      {
        "name": "APP_PASSWORD",
        "description": "Login password",
        "secret": true
      }
    ]
  },
  "entities": [
    {
      "name": "project",
      "plural": "projects",
      "description": "Projects managed by the target application"
    }
  ],
  "commands": [
    {
      "id": "projects-list",
      "path": ["projects", "list"],
      "description": "List projects",
      "mode": "auto",
      "requestRecipeId": "projects-list-api",
      "flowId": "projects-list-ui",
      "inputs": [
        {
          "name": "limit",
          "flag": "--limit",
          "type": "number",
          "description": "Maximum number of items to return",
          "required": false
        }
      ],
      "output": {
        "type": "json"
      }
    }
  ],
  "requestRecipes": [
    {
      "id": "projects-list-api",
      "method": "GET",
      "url": "/api/projects",
      "headers": {
        "accept": "application/json"
      },
      "query": {
        "limit": "{{args.limit}}"
      },
      "responseType": "json",
      "useCookies": true
    }
  ],
  "flows": [
    {
      "id": "auth-login",
      "description": "Replace the placeholder login flow with real captured selectors",
      "steps": [
        {
          "action": "open",
          "url": "{{auth.loginUrl}}"
        },
        {
          "action": "snapshot",
          "interactive": true,
          "saveAs": "loginSnapshot"
        },
        {
          "action": "saveState"
        }
      ],
      "result": {
        "template": "Replace auth-login with captured selectors before using it."
      }
    },
    {
      "id": "projects-list-ui",
      "description": "Open the projects page and capture the page text",
      "steps": [
        {
          "action": "loadState",
          "optional": true
        },
        {
          "action": "open",
          "url": "{{app.baseUrl}}/projects"
        },
        {
          "action": "waitForLoad",
          "state": "networkidle"
        },
        {
          "action": "getText",
          "target": "body",
          "saveAs": "pageText"
        }
      ],
      "result": {
        "capture": "pageText"
      }
    }
  ],
  "selectors": [
    {
      "id": "projects-nav",
      "value": "text=Projects",
      "notes": "Main navigation entry for projects"
    }
  ],
  "regeneration": {
    "capturedAt": "2026-03-10T00:00:00.000Z",
    "source": "runtime-observation",
    "sourceNotes": [
      "Replace the placeholder examples with live-captured data before rendering the CLI"
    ],
    "fingerprints": {
      "target": "https://example.com"
    }
  }
}
